Frame 1: 66 bytes on wire (528 bits), 66 bytes captured (528 bits) on interface \Device\NPF_{C482FEC6-D8FC-46E2-94DA-BDCF5658B334}, id 0
    Interface id: 0 (\Device\NPF_{C482FEC6-D8FC-46E2-94DA-BDCF5658B334})
        Interface name: \Device\NPF_{C482FEC6-D8FC-46E2-94DA-BDCF5658B334}
        Interface description: \u200F\u200FWi-Fi 2
    Encapsulation type: Ethernet (1)
    Arrival Time: Oct 12, 2022 03:03:33.105702000 EEST
    [Time shift for this packet: 0.000000000 seconds]
    Epoch Time: 1665533013.105702000 seconds
    [Time delta from previous captured frame: 0.000000000 seconds]
    [Time delta from previous displayed frame: 0.000000000 seconds]
    [Time since reference or first frame: 0.000000000 seconds]
    Frame Number: 1
    Frame Length: 66 bytes (528 bits)
    Capture Length: 66 bytes (528 bits)
    [Frame is marked: False]
    [Frame is ignored: False]
    [Protocols in frame: eth:ethertype:ip:tcp]
Ethernet II, Src: D-LinkIn_2b:90:93 (bc:0f:9a:2b:90:93), Dst: Technico_22:47:7e (d4:35:1d:22:47:7e)
    Destination: Technico_22:47:7e (d4:35:1d:22:47:7e)
        Address: Technico_22:47:7e (d4:35:1d:22:47:7e)
        .... ..0. .... .... .... .... = LG bit: Globally unique address (factory default)
        .... ...0 .... .... .... .... = IG bit: Individual address (unicast)
    Source: D-LinkIn_2b:90:93 (bc:0f:9a:2b:90:93)
        Address: D-LinkIn_2b:90:93 (bc:0f:9a:2b:90:93)
        .... ..0. .... .... .... .... = LG bit: Globally unique address (factory default)
        .... ...0 .... .... .... .... = IG bit: Individual address (unicast)
    Type: IPv4 (0x0800)
Internet Protocol Version 4, Src: 192.168.1.221, Dst: 193.34.188.81
    0100 .... = Version: 4
    .... 0101 = Header Length: 20 bytes (5)
    Differentiated Services Field: 0x00 (DSCP: CS0, ECN: Not-ECT)
        0000 00.. = Differentiated Services Codepoint: Default (0)
        .... ..00 = Explicit Congestion Notification: Not ECN-Capable Transport (0)
    Total Length: 52
    Identification: 0x418a (16778)
    Flags: 0x40, Don't fragment
        0... .... = Reserved bit: Not set
        .1.. .... = Don't fragment: Set
        ..0. .... = More fragments: Not set
    ...0 0000 0000 0000 = Fragment Offset: 0
    Time to Live: 128
    Protocol: TCP (6)
    Header Checksum: 0x7940 [validation disabled]
    [Header checksum status: Unverified]
    Source Address: 192.168.1.221
    Destination Address: 193.34.188.81
Transmission Control Protocol, Src Port: 59047, Dst Port: 443, Seq: 0, Len: 0
    Source Port: 59047
    Destination Port: 443
    [Stream index: 0]
    [Conversation completeness: Incomplete (0)]
    [TCP Segment Len: 0]
    Sequence Number: 0    (relative sequence number)
    Sequence Number (raw): 3236319894
    [Next Sequence Number: 1    (relative sequence number)]
    Acknowledgment Number: 0
    Acknowledgment number (raw): 0
    1000 .... = Header Length: 32 bytes (8)
    Flags: 0x002 (SYN)
        000. .... .... = Reserved: Not set
        ...0 .... .... = Nonce: Not set
        .... 0... .... = Congestion Window Reduced (CWR): Not set
        .... .0.. .... = ECN-Echo: Not set
        .... ..0. .... = Urgent: Not set
        .... ...0 .... = Acknowledgment: Not set
        .... .... 0... = Push: Not set
        .... .... .0.. = Reset: Not set
        .... .... ..1. = Syn: Set
            [Expert Info (Chat/Sequence): Connection establish request (SYN): server port 443]
                [Connection establish request (SYN): server port 443]
                [Severity level: Chat]
                [Group: Sequence]
        .... .... ...0 = Fin: Not set
        [TCP Flags: ··········S·]
    Window: 64240
    [Calculated window size: 64240]
    Checksum: 0x3846 [unverified]
    [Checksum Status: Unverified]
    Urgent Pointer: 0
    Options: (12 bytes), Maximum segment size, No-Operation (NOP), Window scale, No-Operation (NOP), No-Operation (NOP), SACK permitted
        TCP Option - Maximum segment size: 1460 bytes
            Kind: Maximum Segment Size (2)
            Length: 4
            MSS Value: 1460
        TCP Option - No-Operation (NOP)
            Kind: No-Operation (1)
        TCP Option - Window scale: 8 (multiply by 256)
            Kind: Window Scale (3)
            Length: 3
            Shift count: 8
            [Multiplier: 256]
        TCP Option - No-Operation (NOP)
            Kind: No-Operation (1)
        TCP Option - No-Operation (NOP)
            Kind: No-Operation (1)
        TCP Option - SACK permitted
            Kind: SACK Permitted (4)
            Length: 2
    [Timestamps]
        [Time since first frame in this TCP stream: 0.000000000 seconds]
        [Time since previous frame in this TCP stream: 0.000000000 seconds]

Frame 2: 66 bytes on wire (528 bits), 66 bytes captured (528 bits) on interface \Device\NPF_{C482FEC6-D8FC-46E2-94DA-BDCF5658B334}, id 0
    Interface id: 0 (\Device\NPF_{C482FEC6-D8FC-46E2-94DA-BDCF5658B334})
        Interface name: \Device\NPF_{C482FEC6-D8FC-46E2-94DA-BDCF5658B334}
        Interface description: \u200F\u200FWi-Fi 2
    Encapsulation type: Ethernet (1)
    Arrival Time: Oct 12, 2022 03:03:33.166796000 EEST
    [Time shift for this packet: 0.000000000 seconds]
    Epoch Time: 1665533013.166796000 seconds
    [Time delta from previous captured frame: 0.061094000 seconds]
    [Time delta from previous displayed frame: 0.061094000 seconds]
    [Time since reference or first frame: 0.061094000 seconds]
    Frame Number: 2
    Frame Length: 66 bytes (528 bits)
    Capture Length: 66 bytes (528 bits)
    [Frame is marked: False]
    [Frame is ignored: False]
    [Protocols in frame: eth:ethertype:ip:tcp]
Ethernet II, Src: Technico_22:47:7e (d4:35:1d:22:47:7e), Dst: D-LinkIn_2b:90:93 (bc:0f:9a:2b:90:93)
    Destination: D-LinkIn_2b:90:93 (bc:0f:9a:2b:90:93)
        Address: D-LinkIn_2b:90:93 (bc:0f:9a:2b:90:93)
        .... ..0. .... .... .... .... = LG bit: Globally unique address (factory default)
        .... ...0 .... .... .... .... = IG bit: Individual address (unicast)
    Source: Technico_22:47:7e (d4:35:1d:22:47:7e)
        Address: Technico_22:47:7e (d4:35:1d:22:47:7e)
        .... ..0. .... .... .... .... = LG bit: Globally unique address (factory default)
        .... ...0 .... .... .... .... = IG bit: Individual address (unicast)
    Type: IPv4 (0x0800)
Internet Protocol Version 4, Src: 193.34.188.81, Dst: 192.168.1.221
    0100 .... = Version: 4
    .... 0101 = Header Length: 20 bytes (5)
    Differentiated Services Field: 0xa0 (DSCP: CS5, ECN: Not-ECT)
        1010 00.. = Differentiated Services Codepoint: Class Selector 5 (40)
        .... ..00 = Explicit Congestion Notification: Not ECN-Capable Transport (0)
    Total Length: 52
    Identification: 0x797f (31103)
    Flags: 0x40, Don't fragment
        0... .... = Reserved bit: Not set
        .1.. .... = Don't fragment: Set
        ..0. .... = More fragments: Not set
    ...0 0000 0000 0000 = Fragment Offset: 0
    Time to Live: 114
    Protocol: TCP (6)
    Header Checksum: 0x4eab [validation disabled]
    [Header checksum status: Unverified]
    Source Address: 193.34.188.81
    Destination Address: 192.168.1.221
Transmission Control Protocol, Src Port: 443, Dst Port: 59047, Seq: 0, Ack: 1, Len: 0
    Source Port: 443
    Destination Port: 59047
    [Stream index: 0]
    [Conversation completeness: Incomplete, SYN_SENT (1)]
    [TCP Segment Len: 0]
    Sequence Number: 0    (relative sequence number)
    Sequence Number (raw): 2564523209
    [Next Sequence Number: 1    (relative sequence number)]
    Acknowledgment Number: 1    (relative ack number)
    Acknowledgment number (raw): 3236319895
    1000 .... = Header Length: 32 bytes (8)
    Flags: 0x012 (SYN, ACK)
        000. .... .... = Reserved: Not set
        ...0 .... .... = Nonce: Not set
        .... 0... .... = Congestion Window Reduced (CWR): Not set
        .... .0.. .... = ECN-Echo: Not set
        .... ..0. .... = Urgent: Not set
        .... ...1 .... = Acknowledgment: Set
        .... .... 0... = Push: Not set
        .... .... .0.. = Reset: Not set
        .... .... ..1. = Syn: Set
            [Expert Info (Chat/Sequence): Connection establish acknowledge (SYN+ACK): server port 443]
                [Connection establish acknowledge (SYN+ACK): server port 443]
                [Severity level: Chat]
                [Group: Sequence]
        .... .... ...0 = Fin: Not set
        [TCP Flags: ·······A··S·]
    Window: 8192
    [Calculated window size: 8192]
    Checksum: 0xf588 [unverified]
    [Checksum Status: Unverified]
    Urgent Pointer: 0
    Options: (12 bytes), Maximum segment size, No-Operation (NOP), Window scale, No-Operation (NOP), No-Operation (NOP), SACK permitted
        TCP Option - Maximum segment size: 1452 bytes
            Kind: Maximum Segment Size (2)
            Length: 4
            MSS Value: 1452
        TCP Option - No-Operation (NOP)
            Kind: No-Operation (1)
        TCP Option - Window scale: 8 (multiply by 256)
            Kind: Window Scale (3)
            Length: 3
            Shift count: 8
            [Multiplier: 256]
        TCP Option - No-Operation (NOP)
            Kind: No-Operation (1)
        TCP Option - No-Operation (NOP)
            Kind: No-Operation (1)
        TCP Option - SACK permitted
            Kind: SACK Permitted (4)
            Length: 2
    [Timestamps]
        [Time since first frame in this TCP stream: 0.061094000 seconds]
        [Time since previous frame in this TCP stream: 0.061094000 seconds]
    [SEQ/ACK analysis]
        [This is an ACK to the segment in frame: 1]
        [The RTT to ACK the segment was: 0.061094000 seconds]

Frame 3: 54 bytes on wire (432 bits), 54 bytes captured (432 bits) on interface \Device\NPF_{C482FEC6-D8FC-46E2-94DA-BDCF5658B334}, id 0
    Interface id: 0 (\Device\NPF_{C482FEC6-D8FC-46E2-94DA-BDCF5658B334})
        Interface name: \Device\NPF_{C482FEC6-D8FC-46E2-94DA-BDCF5658B334}
        Interface description: \u200F\u200FWi-Fi 2
    Encapsulation type: Ethernet (1)
    Arrival Time: Oct 12, 2022 03:03:33.166838000 EEST
    [Time shift for this packet: 0.000000000 seconds]
    Epoch Time: 1665533013.166838000 seconds
    [Time delta from previous captured frame: 0.000042000 seconds]
    [Time delta from previous displayed frame: 0.000042000 seconds]
    [Time since reference or first frame: 0.061136000 seconds]
    Frame Number: 3
    Frame Length: 54 bytes (432 bits)
    Capture Length: 54 bytes (432 bits)
    [Frame is marked: False]
    [Frame is ignored: False]
    [Protocols in frame: eth:ethertype:ip:tcp]
Ethernet II, Src: D-LinkIn_2b:90:93 (bc:0f:9a:2b:90:93), Dst: Technico_22:47:7e (d4:35:1d:22:47:7e)
    Destination: Technico_22:47:7e (d4:35:1d:22:47:7e)
        Address: Technico_22:47:7e (d4:35:1d:22:47:7e)
        .... ..0. .... .... .... .... = LG bit: Globally unique address (factory default)
        .... ...0 .... .... .... .... = IG bit: Individual address (unicast)
    Source: D-LinkIn_2b:90:93 (bc:0f:9a:2b:90:93)
        Address: D-LinkIn_2b:90:93 (bc:0f:9a:2b:90:93)
        .... ..0. .... .... .... .... = LG bit: Globally unique address (factory default)
        .... ...0 .... .... .... .... = IG bit: Individual address (unicast)
    Type: IPv4 (0x0800)
Internet Protocol Version 4, Src: 192.168.1.221, Dst: 193.34.188.81
    0100 .... = Version: 4
    .... 0101 = Header Length: 20 bytes (5)
    Differentiated Services Field: 0x00 (DSCP: CS0, ECN: Not-ECT)
        0000 00.. = Differentiated Services Codepoint: Default (0)
        .... ..00 = Explicit Congestion Notification: Not ECN-Capable Transport (0)
    Total Length: 40
    Identification: 0x418b (16779)
    Flags: 0x40, Don't fragment
        0... .... = Reserved bit: Not set
        .1.. .... = Don't fragment: Set
        ..0. .... = More fragments: Not set
    ...0 0000 0000 0000 = Fragment Offset: 0
    Time to Live: 128
    Protocol: TCP (6)
    Header Checksum: 0x794b [validation disabled]
    [Header checksum status: Unverified]
    Source Address: 192.168.1.221
    Destination Address: 193.34.188.81
Transmission Control Protocol, Src Port: 59047, Dst Port: 443, Seq: 1, Ack: 1, Len: 0
    Source Port: 59047
    Destination Port: 443
    [Stream index: 0]
    [Conversation completeness: Incomplete, CLIENT_ESTABLISHED (3)]
    [TCP Segment Len: 0]
    Sequence Number: 1    (relative sequence number)
    Sequence Number (raw): 3236319895
    [Next Sequence Number: 1    (relative sequence number)]
    Acknowledgment Number: 1    (relative ack number)
    Acknowledgment number (raw): 2564523210
    0101 .... = Header Length: 20 bytes (5)
    Flags: 0x010 (ACK)
        000. .... .... = Reserved: Not set
        ...0 .... .... = Nonce: Not set
        .... 0... .... = Congestion Window Reduced (CWR): Not set
        .... .0.. .... = ECN-Echo: Not set
        .... ..0. .... = Urgent: Not set
        .... ...1 .... = Acknowledgment: Set
        .... .... 0... = Push: Not set
        .... .... .0.. = Reset: Not set
        .... .... ..0. = Syn: Not set
        .... .... ...0 = Fin: Not set
        [TCP Flags: ·······A····]
    Window: 260
    [Calculated window size: 66560]
    [Window size scaling factor: 256]
    Checksum: 0x5550 [unverified]
    [Checksum Status: Unverified]
    Urgent Pointer: 0
    [Timestamps]
        [Time since first frame in this TCP stream: 0.061136000 seconds]
        [Time since previous frame in this TCP stream: 0.000042000 seconds]
    [SEQ/ACK analysis]
        [This is an ACK to the segment in frame: 2]
        [The RTT to ACK the segment was: 0.000042000 seconds]
        [iRTT: 0.061136000 seconds]

Frame 4: 571 bytes on wire (4568 bits), 571 bytes captured (4568 bits) on interface \Device\NPF_{C482FEC6-D8FC-46E2-94DA-BDCF5658B334}, id 0
    Interface id: 0 (\Device\NPF_{C482FEC6-D8FC-46E2-94DA-BDCF5658B334})
        Interface name: \Device\NPF_{C482FEC6-D8FC-46E2-94DA-BDCF5658B334}
        Interface description: \u200F\u200FWi-Fi 2
    Encapsulation type: Ethernet (1)
    Arrival Time: Oct 12, 2022 03:03:33.168340000 EEST
    [Time shift for this packet: 0.000000000 seconds]
    Epoch Time: 1665533013.168340000 seconds
    [Time delta from previous captured frame: 0.001502000 seconds]
    [Time delta from previous displayed frame: 0.001502000 seconds]
    [Time since reference or first frame: 0.062638000 seconds]
    Frame Number: 4
    Frame Length: 571 bytes (4568 bits)
    Capture Length: 571 bytes (4568 bits)
    [Frame is marked: False]
    [Frame is ignored: False]
    [Protocols in frame: eth:ethertype:ip:tcp:tls]
Ethernet II, Src: D-LinkIn_2b:90:93 (bc:0f:9a:2b:90:93), Dst: Technico_22:47:7e (d4:35:1d:22:47:7e)
    Destination: Technico_22:47:7e (d4:35:1d:22:47:7e)
        Address: Technico_22:47:7e (d4:35:1d:22:47:7e)
        .... ..0. .... .... .... .... = LG bit: Globally unique address (factory default)
        .... ...0 .... .... .... .... = IG bit: Individual address (unicast)
    Source: D-LinkIn_2b:90:93 (bc:0f:9a:2b:90:93)
        Address: D-LinkIn_2b:90:93 (bc:0f:9a:2b:90:93)
        .... ..0. .... .... .... .... = LG bit: Globally unique address (factory default)
        .... ...0 .... .... .... .... = IG bit: Individual address (unicast)
    Type: IPv4 (0x0800)
Internet Protocol Version 4, Src: 192.168.1.221, Dst: 193.34.188.81
    0100 .... = Version: 4
    .... 0101 = Header Length: 20 bytes (5)
    Differentiated Services Field: 0x00 (DSCP: CS0, ECN: Not-ECT)
        0000 00.. = Differentiated Services Codepoint: Default (0)
        .... ..00 = Explicit Congestion Notification: Not ECN-Capable Transport (0)
    Total Length: 557
    Identification: 0x418c (16780)
    Flags: 0x40, Don't fragment
        0... .... = Reserved bit: Not set
        .1.. .... = Don't fragment: Set
        ..0. .... = More fragments: Not set
    ...0 0000 0000 0000 = Fragment Offset: 0
    Time to Live: 128
    Protocol: TCP (6)
    Header Checksum: 0x7745 [validation disabled]
    [Header checksum status: Unverified]
    Source Address: 192.168.1.221
    Destination Address: 193.34.188.81
Transmission Control Protocol, Src Port: 59047, Dst Port: 443, Seq: 1, Ack: 1, Len: 517
    Source Port: 59047
    Destination Port: 443
    [Stream index: 0]
    [Conversation completeness: Incomplete, ESTABLISHED (7)]
    [TCP Segment Len: 517]
    Sequence Number: 1    (relative sequence number)
    Sequence Number (raw): 3236319895
    [Next Sequence Number: 518    (relative sequence number)]
    Acknowledgment Number: 1    (relative ack number)
    Acknowledgment number (raw): 2564523210
    0101 .... = Header Length: 20 bytes (5)
    Flags: 0x018 (PSH, ACK)
        000. .... .... = Reserved: Not set
        ...0 .... .... = Nonce: Not set
        .... 0... .... = Congestion Window Reduced (CWR): Not set
        .... .0.. .... = ECN-Echo: Not set
        .... ..0. .... = Urgent: Not set
        .... ...1 .... = Acknowledgment: Set
        .... .... 1... = Push: Set
        .... .... .0.. = Reset: Not set
        .... .... ..0. = Syn: Not set
        .... .... ...0 = Fin: Not set
        [TCP Flags: ·······AP···]
    Window: 260
    [Calculated window size: 66560]
    [Window size scaling factor: 256]
    Checksum: 0x81ed [unverified]
    [Checksum Status: Unverified]
    Urgent Pointer: 0
    [Timestamps]
        [Time since first frame in this TCP stream: 0.062638000 seconds]
        [Time since previous frame in this TCP stream: 0.001502000 seconds]
    [SEQ/ACK analysis]
        [iRTT: 0.061136000 seconds]
        [Bytes in flight: 517]
        [Bytes sent since last PSH flag: 517]
    TCP payload (517 bytes)
Transport Layer Security
    TLSv1 Record Layer: Handshake Protocol: Client Hello
        Content Type: Handshake (22)
        Version: TLS 1.0 (0x0301)
        Length: 512
        Handshake Protocol: Client Hello
            Handshake Type: Client Hello (1)
            Length: 508
            Version: TLS 1.2 (0x0303)
            Random: b9bdf1866b10cea7dac8676e9234afaf1a4898c9dfffa5c174aeb75a77599d22
                GMT Unix Time: Sep 30, 2068 15:18:14.000000000 EEST
                Random Bytes: 6b10cea7dac8676e9234afaf1a4898c9dfffa5c174aeb75a77599d22
            Session ID Length: 32
            Session ID: 13d0c147b2c2903711d940ae407423d2ec34cc95747318d94dfbb20c83dc799b
            Cipher Suites Length: 34
            Cipher Suites (17 suites)
                Cipher Suite: TLS_AES_128_GCM_SHA256 (0x1301)
                Cipher Suite: TLS_CHACHA20_POLY1305_SHA256 (0x1303)
                Cipher Suite: TLS_AES_256_GCM_SHA384 (0x1302)
                Cipher Suite: TLS_ECDHE_ECDSA_WITH_AES_128_GCM_SHA256 (0xc02b)
                Cipher Suite: TLS_ECDHE_RSA_WITH_AES_128_GCM_SHA256 (0xc02f)
                Cipher Suite: TLS_ECDHE_ECDSA_WITH_CHACHA20_POLY1305_SHA256 (0xcca9)
                Cipher Suite: TLS_ECDHE_RSA_WITH_CHACHA20_POLY1305_SHA256 (0xcca8)
                Cipher Suite: TLS_ECDHE_ECDSA_WITH_AES_256_GCM_SHA384 (0xc02c)
                Cipher Suite: TLS_ECDHE_RSA_WITH_AES_256_GCM_SHA384 (0xc030)
                Cipher Suite: TLS_ECDHE_ECDSA_WITH_AES_256_CBC_SHA (0xc00a)
                Cipher Suite: TLS_ECDHE_ECDSA_WITH_AES_128_CBC_SHA (0xc009)
                Cipher Suite: TLS_ECDHE_RSA_WITH_AES_128_CBC_SHA (0xc013)
                Cipher Suite: TLS_ECDHE_RSA_WITH_AES_256_CBC_SHA (0xc014)
                Cipher Suite: TLS_RSA_WITH_AES_128_GCM_SHA256 (0x009c)
                Cipher Suite: TLS_RSA_WITH_AES_256_GCM_SHA384 (0x009d)
                Cipher Suite: TLS_RSA_WITH_AES_128_CBC_SHA (0x002f)
                Cipher Suite: TLS_RSA_WITH_AES_256_CBC_SHA (0x0035)
            Compression Methods Length: 1
            Compression Methods (1 method)
                Compression Method: null (0)
            Extensions Length: 401
            Extension: server_name (len=21)
                Type: server_name (0)
                Length: 21
                Server Name Indication extension
                    Server Name list length: 19
                    Server Name Type: host_name (0)
                    Server Name length: 16
                    Server Name: www.hattrick.org
            Extension: extended_master_secret (len=0)
                Type: extended_master_secret (23)
                Length: 0
            Extension: renegotiation_info (len=1)
                Type: renegotiation_info (65281)
                Length: 1
                Renegotiation Info extension
                    Renegotiation info extension length: 0
            Extension: supported_groups (len=14)
                Type: supported_groups (10)
                Length: 14
                Supported Groups List Length: 12
                Supported Groups (6 groups)
                    Supported Group: x25519 (0x001d)
                    Supported Group: secp256r1 (0x0017)
                    Supported Group: secp384r1 (0x0018)
                    Supported Group: secp521r1 (0x0019)
                    Supported Group: ffdhe2048 (0x0100)
                    Supported Group: ffdhe3072 (0x0101)
            Extension: ec_point_formats (len=2)
                Type: ec_point_formats (11)
                Length: 2
                EC point formats Length: 1
                Elliptic curves point formats (1)
                    EC point format: uncompressed (0)
            Extension: application_layer_protocol_negotiation (len=14)
                Type: application_layer_protocol_negotiation (16)
                Length: 14
                ALPN Extension Length: 12
                ALPN Protocol
                    ALPN string length: 2
                    ALPN Next Protocol: h2
                    ALPN string length: 8
                    ALPN Next Protocol: http/1.1
            Extension: status_request (len=5)
                Type: status_request (5)
                Length: 5
                Certificate Status Type: OCSP (1)
                Responder ID list Length: 0
                Request Extensions Length: 0
            Extension: delegated_credentials (len=10)
                Type: delegated_credentials (34)
                Length: 10
                Signature Hash Algorithms Length: 8
                Signature Hash Algorithms (4 algorithms)
                    Signature Algorithm: ecdsa_secp256r1_sha256 (0x0403)
                        Signature Hash Algorithm Hash: SHA256 (4)
                        Signature Hash Algorithm Signature: ECDSA (3)
                    Signature Algorithm: ecdsa_secp384r1_sha384 (0x0503)
                        Signature Hash Algorithm Hash: SHA384 (5)
                        Signature Hash Algorithm Signature: ECDSA (3)
                    Signature Algorithm: ecdsa_secp521r1_sha512 (0x0603)
                        Signature Hash Algorithm Hash: SHA512 (6)
                        Signature Hash Algorithm Signature: ECDSA (3)
                    Signature Algorithm: ecdsa_sha1 (0x0203)
                        Signature Hash Algorithm Hash: SHA1 (2)
                        Signature Hash Algorithm Signature: ECDSA (3)
            Extension: key_share (len=107)
                Type: key_share (51)
                Length: 107
                Key Share extension
                    Client Key Share Length: 105
                    Key Share Entry: Group: x25519, Key Exchange length: 32
                        Group: x25519 (29)
                        Key Exchange Length: 32
                        Key Exchange: 951f1ed95a001010fc49087f66c39ce98596d29821c8793abc5ae75d744e373d
                    Key Share Entry: Group: secp256r1, Key Exchange length: 65
                        Group: secp256r1 (23)
                        Key Exchange Length: 65
                        Key Exchange: 0446437f3c075128bb6d91529236e8b1b262cef8aedc4deae857473425cb0a56388f7858…
            Extension: supported_versions (len=5)
                Type: supported_versions (43)
                Length: 5
                Supported Versions length: 4
                Supported Version: TLS 1.3 (0x0304)
                Supported Version: TLS 1.2 (0x0303)
            Extension: signature_algorithms (len=24)
                Type: signature_algorithms (13)
                Length: 24
                Signature Hash Algorithms Length: 22
                Signature Hash Algorithms (11 algorithms)
                    Signature Algorithm: ecdsa_secp256r1_sha256 (0x0403)
                        Signature Hash Algorithm Hash: SHA256 (4)
                        Signature Hash Algorithm Signature: ECDSA (3)
                    Signature Algorithm: ecdsa_secp384r1_sha384 (0x0503)
                        Signature Hash Algorithm Hash: SHA384 (5)
                        Signature Hash Algorithm Signature: ECDSA (3)
                    Signature Algorithm: ecdsa_secp521r1_sha512 (0x0603)
                        Signature Hash Algorithm Hash: SHA512 (6)
                        Signature Hash Algorithm Signature: ECDSA (3)
                    Signature Algorithm: rsa_pss_rsae_sha256 (0x0804)
                        Signature Hash Algorithm Hash: Unknown (8)
                        Signature Hash Algorithm Signature: SM2 (4)
                    Signature Algorithm: rsa_pss_rsae_sha384 (0x0805)
                        Signature Hash Algorithm Hash: Unknown (8)
                        Signature Hash Algorithm Signature: Unknown (5)
                    Signature Algorithm: rsa_pss_rsae_sha512 (0x0806)
                        Signature Hash Algorithm Hash: Unknown (8)
                        Signature Hash Algorithm Signature: Unknown (6)
                    Signature Algorithm: rsa_pkcs1_sha256 (0x0401)
                        Signature Hash Algorithm Hash: SHA256 (4)
                        Signature Hash Algorithm Signature: RSA (1)
                    Signature Algorithm: rsa_pkcs1_sha384 (0x0501)
                        Signature Hash Algorithm Hash: SHA384 (5)
                        Signature Hash Algorithm Signature: RSA (1)
                    Signature Algorithm: rsa_pkcs1_sha512 (0x0601)
                        Signature Hash Algorithm Hash: SHA512 (6)
                        Signature Hash Algorithm Signature: RSA (1)
                    Signature Algorithm: ecdsa_sha1 (0x0203)
                        Signature Hash Algorithm Hash: SHA1 (2)
                        Signature Hash Algorithm Signature: ECDSA (3)
                    Signature Algorithm: rsa_pkcs1_sha1 (0x0201)
                        Signature Hash Algorithm Hash: SHA1 (2)
                        Signature Hash Algorithm Signature: RSA (1)
            Extension: record_size_limit (len=2)
                Type: record_size_limit (28)
                Length: 2
                Record Size Limit: 16385
            Extension: padding (len=144)
                Type: padding (21)
                Length: 144
                Padding Data: 000000000000000000000000000000000000000000000000000000000000000000000000…
            [JA3 Fullstring: 771,4865-4867-4866-49195-49199-52393-52392-49196-49200-49162-49161-49171-49172-156-157-47-53,0-23-65281-10-11-16-5-34-51-43-13-28-21,29-23-24-25-256-257,0]
            [JA3: ad55557b7cbd735c2627f7ebb3b3d493]

Frame 5: 1506 bytes on wire (12048 bits), 1506 bytes captured (12048 bits) on interface \Device\NPF_{C482FEC6-D8FC-46E2-94DA-BDCF5658B334}, id 0
    Interface id: 0 (\Device\NPF_{C482FEC6-D8FC-46E2-94DA-BDCF5658B334})
        Interface name: \Device\NPF_{C482FEC6-D8FC-46E2-94DA-BDCF5658B334}
        Interface description: \u200F\u200FWi-Fi 2
    Encapsulation type: Ethernet (1)
    Arrival Time: Oct 12, 2022 03:03:33.232463000 EEST
    [Time shift for this packet: 0.000000000 seconds]
    Epoch Time: 1665533013.232463000 seconds
    [Time delta from previous captured frame: 0.064123000 seconds]
    [Time delta from previous displayed frame: 0.064123000 seconds]
    [Time since reference or first frame: 0.126761000 seconds]
    Frame Number: 5
    Frame Length: 1506 bytes (12048 bits)
    Capture Length: 1506 bytes (12048 bits)
    [Frame is marked: False]
    [Frame is ignored: False]
    [Protocols in frame: eth:ethertype:ip:tcp:tls]
Ethernet II, Src: Technico_22:47:7e (d4:35:1d:22:47:7e), Dst: D-LinkIn_2b:90:93 (bc:0f:9a:2b:90:93)
    Destination: D-LinkIn_2b:90:93 (bc:0f:9a:2b:90:93)
        Address: D-LinkIn_2b:90:93 (bc:0f:9a:2b:90:93)
        .... ..0. .... .... .... .... = LG bit: Globally unique address (factory default)
        .... ...0 .... .... .... .... = IG bit: Individual address (unicast)
    Source: Technico_22:47:7e (d4:35:1d:22:47:7e)
        Address: Technico_22:47:7e (d4:35:1d:22:47:7e)
        .... ..0. .... .... .... .... = LG bit: Globally unique address (factory default)
        .... ...0 .... .... .... .... = IG bit: Individual address (unicast)
    Type: IPv4 (0x0800)
Internet Protocol Version 4, Src: 193.34.188.81, Dst: 192.168.1.221
    0100 .... = Version: 4
    .... 0101 = Header Length: 20 bytes (5)
    Differentiated Services Field: 0xa0 (DSCP: CS5, ECN: Not-ECT)
        1010 00.. = Differentiated Services Codepoint: Class Selector 5 (40)
        .... ..00 = Explicit Congestion Notification: Not ECN-Capable Transport (0)
    Total Length: 1492
    Identification: 0x7980 (31104)
    Flags: 0x40, Don't fragment
        0... .... = Reserved bit: Not set
        .1.. .... = Don't fragment: Set
        ..0. .... = More fragments: Not set
    ...0 0000 0000 0000 = Fragment Offset: 0
    Time to Live: 114
    Protocol: TCP (6)
    Header Checksum: 0x490a [validation disabled]
    [Header checksum status: Unverified]
    Source Address: 193.34.188.81
    Destination Address: 192.168.1.221
Transmission Control Protocol, Src Port: 443, Dst Port: 59047, Seq: 1, Ack: 518, Len: 1452
    Source Port: 443
    Destination Port: 59047
    [Stream index: 0]
    [Conversation completeness: Incomplete, DATA (15)]
    [TCP Segment Len: 1452]
    Sequence Number: 1    (relative sequence number)
    Sequence Number (raw): 2564523210
    [Next Sequence Number: 1453    (relative sequence number)]
    Acknowledgment Number: 518    (relative ack number)
    Acknowledgment number (raw): 3236320412
    0101 .... = Header Length: 20 bytes (5)
    Flags: 0x010 (ACK)
        000. .... .... = Reserved: Not set
        ...0 .... .... = Nonce: Not set
        .... 0... .... = Congestion Window Reduced (CWR): Not set
        .... .0.. .... = ECN-Echo: Not set
        .... ..0. .... = Urgent: Not set
        .... ...1 .... = Acknowledgment: Set
        .... .... 0... = Push: Not set
        .... .... .0.. = Reset: Not set
        .... .... ..0. = Syn: Not set
        .... .... ...0 = Fin: Not set
        [TCP Flags: ·······A····]
    Window: 260
    [Calculated window size: 66560]
    [Window size scaling factor: 256]
    Checksum: 0xf5dd [unverified]
    [Checksum Status: Unverified]
    Urgent Pointer: 0
    [Timestamps]
        [Time since first frame in this TCP stream: 0.126761000 seconds]
        [Time since previous frame in this TCP stream: 0.064123000 seconds]
    [SEQ/ACK analysis]
        [This is an ACK to the segment in frame: 4]
        [The RTT to ACK the segment was: 0.064123000 seconds]
        [iRTT: 0.061136000 seconds]
        [Bytes in flight: 1452]
        [Bytes sent since last PSH flag: 1452]
    TCP payload (1452 bytes)
    TCP segment data (1452 bytes)
Transport Layer Security

Frame 6: 1506 bytes on wire (12048 bits), 1506 bytes captured (12048 bits) on interface \Device\NPF_{C482FEC6-D8FC-46E2-94DA-BDCF5658B334}, id 0
    Interface id: 0 (\Device\NPF_{C482FEC6-D8FC-46E2-94DA-BDCF5658B334})
        Interface name: \Device\NPF_{C482FEC6-D8FC-46E2-94DA-BDCF5658B334}
        Interface description: \u200F\u200FWi-Fi 2
    Encapsulation type: Ethernet (1)
    Arrival Time: Oct 12, 2022 03:03:33.232463000 EEST
    [Time shift for this packet: 0.000000000 seconds]
    Epoch Time: 1665533013.232463000 seconds
    [Time delta from previous captured frame: 0.000000000 seconds]
    [Time delta from previous displayed frame: 0.000000000 seconds]
    [Time since reference or first frame: 0.126761000 seconds]
    Frame Number: 6
    Frame Length: 1506 bytes (12048 bits)
    Capture Length: 1506 bytes (12048 bits)
    [Frame is marked: False]
    [Frame is ignored: False]
    [Protocols in frame: eth:ethertype:ip:tcp]
Ethernet II, Src: Technico_22:47:7e (d4:35:1d:22:47:7e), Dst: D-LinkIn_2b:90:93 (bc:0f:9a:2b:90:93)
    Destination: D-LinkIn_2b:90:93 (bc:0f:9a:2b:90:93)
        Address: D-LinkIn_2b:90:93 (bc:0f:9a:2b:90:93)
        .... ..0. .... .... .... .... = LG bit: Globally unique address (factory default)
        .... ...0 .... .... .... .... = IG bit: Individual address (unicast)
    Source: Technico_22:47:7e (d4:35:1d:22:47:7e)
        Address: Technico_22:47:7e (d4:35:1d:22:47:7e)
        .... ..0. .... .... .... .... = LG bit: Globally unique address (factory default)
        .... ...0 .... .... .... .... = IG bit: Individual address (unicast)
    Type: IPv4 (0x0800)
Internet Protocol Version 4, Src: 193.34.188.81, Dst: 192.168.1.221
    0100 .... = Version: 4
    .... 0101 = Header Length: 20 bytes (5)
    Differentiated Services Field: 0xa0 (DSCP: CS5, ECN: Not-ECT)
        1010 00.. = Differentiated Services Codepoint: Class Selector 5 (40)
        .... ..00 = Explicit Congestion Notification: Not ECN-Capable Transport (0)
    Total Length: 1492
    Identification: 0x7981 (31105)
    Flags: 0x40, Don't fragment
        0... .... = Reserved bit: Not set
        .1.. .... = Don't fragment: Set
        ..0. .... = More fragments: Not set
    ...0 0000 0000 0000 = Fragment Offset: 0
    Time to Live: 114
    Protocol: TCP (6)
    Header Checksum: 0x4909 [validation disabled]
    [Header checksum status: Unverified]
    Source Address: 193.34.188.81
    Destination Address: 192.168.1.221
Transmission Control Protocol, Src Port: 443, Dst Port: 59047, Seq: 1453, Ack: 518, Len: 1452
    Source Port: 443
    Destination Port: 59047
    [Stream index: 0]
    [Conversation completeness: Incomplete, DATA (15)]
    [TCP Segment Len: 1452]
    Sequence Number: 1453    (relative sequence number)
    Sequence Number (raw): 2564524662
    [Next Sequence Number: 2905    (relative sequence number)]
    Acknowledgment Number: 518    (relative ack number)
    Acknowledgment number (raw): 3236320412
    0101 .... = Header Length: 20 bytes (5)
    Flags: 0x010 (ACK)
        000. .... .... = Reserved: Not set
        ...0 .... .... = Nonce: Not set
        .... 0... .... = Congestion Window Reduced (CWR): Not set
        .... .0.. .... = ECN-Echo: Not set
        .... ..0. .... = Urgent: Not set
        .... ...1 .... = Acknowledgment: Set
        .... .... 0... = Push: Not set
        .... .... .0.. = Reset: Not set
        .... .... ..0. = Syn: Not set
        .... .... ...0 = Fin: Not set
        [TCP Flags: ·······A····]
    Window: 260
    [Calculated window size: 66560]
    [Window size scaling factor: 256]
    Checksum: 0xf220 [unverified]
    [Checksum Status: Unverified]
    Urgent Pointer: 0
    [Timestamps]
        [Time since first frame in this TCP stream: 0.126761000 seconds]
        [Time since previous frame in this TCP stream: 0.000000000 seconds]
    [SEQ/ACK analysis]
        [iRTT: 0.061136000 seconds]
        [Bytes in flight: 2904]
        [Bytes sent since last PSH flag: 2904]
    TCP payload (1452 bytes)
    TCP segment data (1452 bytes)

Frame 7: 54 bytes on wire (432 bits), 54 bytes captured (432 bits) on interface \Device\NPF_{C482FEC6-D8FC-46E2-94DA-BDCF5658B334}, id 0
    Interface id: 0 (\Device\NPF_{C482FEC6-D8FC-46E2-94DA-BDCF5658B334})
        Interface name: \Device\NPF_{C482FEC6-D8FC-46E2-94DA-BDCF5658B334}
        Interface description: \u200F\u200FWi-Fi 2
    Encapsulation type: Ethernet (1)
    Arrival Time: Oct 12, 2022 03:03:33.232549000 EEST
    [Time shift for this packet: 0.000000000 seconds]
    Epoch Time: 1665533013.232549000 seconds
    [Time delta from previous captured frame: 0.000086000 seconds]
    [Time delta from previous displayed frame: 0.000086000 seconds]
    [Time since reference or first frame: 0.126847000 seconds]
    Frame Number: 7
    Frame Length: 54 bytes (432 bits)
    Capture Length: 54 bytes (432 bits)
    [Frame is marked: False]
    [Frame is ignored: False]
    [Protocols in frame: eth:ethertype:ip:tcp]
Ethernet II, Src: D-LinkIn_2b:90:93 (bc:0f:9a:2b:90:93), Dst: Technico_22:47:7e (d4:35:1d:22:47:7e)
    Destination: Technico_22:47:7e (d4:35:1d:22:47:7e)
        Address: Technico_22:47:7e (d4:35:1d:22:47:7e)
        .... ..0. .... .... .... .... = LG bit: Globally unique address (factory default)
        .... ...0 .... .... .... .... = IG bit: Individual address (unicast)
    Source: D-LinkIn_2b:90:93 (bc:0f:9a:2b:90:93)
        Address: D-LinkIn_2b:90:93 (bc:0f:9a:2b:90:93)
        .... ..0. .... .... .... .... = LG bit: Globally unique address (factory default)
        .... ...0 .... .... .... .... = IG bit: Individual address (unicast)
    Type: IPv4 (0x0800)
Internet Protocol Version 4, Src: 192.168.1.221, Dst: 193.34.188.81
    0100 .... = Version: 4
    .... 0101 = Header Length: 20 bytes (5)
    Differentiated Services Field: 0x00 (DSCP: CS0, ECN: Not-ECT)
        0000 00.. = Differentiated Services Codepoint: Default (0)
        .... ..00 = Explicit Congestion Notification: Not ECN-Capable Transport (0)
    Total Length: 40
    Identification: 0x418d (16781)
    Flags: 0x40, Don't fragment
        0... .... = Reserved bit: Not set
        .1.. .... = Don't fragment: Set
        ..0. .... = More fragments: Not set
    ...0 0000 0000 0000 = Fragment Offset: 0
    Time to Live: 128
    Protocol: TCP (6)
    Header Checksum: 0x7949 [validation disabled]
    [Header checksum status: Unverified]
    Source Address: 192.168.1.221
    Destination Address: 193.34.188.81
Transmission Control Protocol, Src Port: 59047, Dst Port: 443, Seq: 518, Ack: 2905, Len: 0
    Source Port: 59047
    Destination Port: 443
    [Stream index: 0]
    [Conversation completeness: Incomplete, DATA (15)]
    [TCP Segment Len: 0]
    Sequence Number: 518    (relative sequence number)
    Sequence Number (raw): 3236320412
    [Next Sequence Number: 518    (relative sequence number)]
    Acknowledgment Number: 2905    (relative ack number)
    Acknowledgment number (raw): 2564526114
    0101 .... = Header Length: 20 bytes (5)
    Flags: 0x010 (ACK)
        000. .... .... = Reserved: Not set
        ...0 .... .... = Nonce: Not set
        .... 0... .... = Congestion Window Reduced (CWR): Not set
        .... .0.. .... = ECN-Echo: Not set
        .... ..0. .... = Urgent: Not set
        .... ...1 .... = Acknowledgment: Set
        .... .... 0... = Push: Not set
        .... .... .0.. = Reset: Not set
        .... .... ..0. = Syn: Not set
        .... .... ...0 = Fin: Not set
        [TCP Flags: ·······A····]
    Window: 260
    [Calculated window size: 66560]
    [Window size scaling factor: 256]
    Checksum: 0x47f3 [unverified]
    [Checksum Status: Unverified]
    Urgent Pointer: 0
    [Timestamps]
        [Time since first frame in this TCP stream: 0.126847000 seconds]
        [Time since previous frame in this TCP stream: 0.000086000 seconds]
    [SEQ/ACK analysis]
        [This is an ACK to the segment in frame: 6]
        [The RTT to ACK the segment was: 0.000086000 seconds]
        [iRTT: 0.061136000 seconds]

Frame 8: 999 bytes on wire (7992 bits), 999 bytes captured (7992 bits) on interface \Device\NPF_{C482FEC6-D8FC-46E2-94DA-BDCF5658B334}, id 0
    Interface id: 0 (\Device\NPF_{C482FEC6-D8FC-46E2-94DA-BDCF5658B334})
        Interface name: \Device\NPF_{C482FEC6-D8FC-46E2-94DA-BDCF5658B334}
        Interface description: \u200F\u200FWi-Fi 2
    Encapsulation type: Ethernet (1)
    Arrival Time: Oct 12, 2022 03:03:33.233526000 EEST
    [Time shift for this packet: 0.000000000 seconds]
    Epoch Time: 1665533013.233526000 seconds
    [Time delta from previous captured frame: 0.000977000 seconds]
    [Time delta from previous displayed frame: 0.000977000 seconds]
